Joblum,Regulatory Affairs Assistant,Pharmacy,"Fairbright Enterprises, Inc.",2021-05-21,Makati City,Not Specified,,Not Specified / In Description,Not Specified / In Description,"FAIRBRIGHT ENTERPRISES, INC. -- a leading service-oriented and Philippine distributor and supplier of Medical and Healthcare supplies and equipment of noted manufacturers from Europe and the United States of America --- is searching for candidates to join our passionate and dynamic team as a REGULATORY AFFAIRS ASSISTANT. As our REGULATORY AFFAIRS ASSISTANT , you will be tasked to: Assist our Regulatory Affairs Manager in the preparation of documents for product registration, clearances, licenses, among others Perform other related tasks, as needed. For this, we are looking for applicants who: Are graduates of BS Pharmacy (Board Certification NOT required) May be proficient in editing software Have basic communication and computer skills Are organized, results-oriented, and team players Are willing to work beyond office hours as needed Are amenable to working in Makati Can start as soon as possible FAIRBRIGHT ENTERPRISES, INC. is a service-oriented Distributor and Supplier of equipment and devices in the healthcare and medical markets. Founded and established in 1978, the Company has continuously grown in coverage with the representation of products from distinguished manufacturers in response to the changing requirements and dynamism of the market that it serves. To find out more, visit www.fairbright.com or Facebook.com/FairbrightPH",Not Specified,Not Specified,Not Specified,Not Specified,Medicine
Joblum,PHARMACIST (PASAY),Pharmacy,MerryMart Grocery Centers Inc,2021-05-21,National Capital Reg,Not Specified,,Not Specified / In Description,Not Specified / In Description,Oversees the day to day operation of the Pharmacy Section in the achievement of its sales targets. Dispenses or supervises dispensing of medications and related supplies following physician’s prescriptions. Reviews prescriptions for accuracy before dispensing the medicine. Dispenses the correct medication in the asked-for amount. Ensures all Pharmacy personnel provides excellent customer/patient service. Identifies fast-moving pharmacy items and ensures prompt replenishment of stocks. Keeps track of the store’s stock of medications and other healthcare supplies. Ensures proper practice of proper pharmacy procedures mandated by the Company and the government. Ensures proper and timely endorsement of return of bad orders to suppliers in coordination with merchandising and warehouse. Helps oversee the accurate and proper monitoring of Pharmacy stocks in the storage and display area. Coordinates with merchandising for stock ordering to support the store sales and service delivery. Ensures prompt replenishment of products in the Pharmacy Section.,Not Specified,Not Specified,Not Specified,Not Specified,Medicine
Joblum,PHARMACIST (PARANAQUE),Pharmacy,MerryMart Grocery Centers Inc,2021-05-21,National Capital Reg,OJT,,Not Specified / In Description,Not Specified / In Description,"Oversees the day to day operation of the Pharmacy Section in the achievement of its sales targets. Dispenses or supervises dispensing of medications and related supplies following physician’s prescriptions. Reviews prescriptions for accuracy before dispensing the medicine. Dispenses the correct medication in the asked-for amount. Ensures all Pharmacy personnel provides excellent customer/patient service. Identifies fast-moving pharmacy items and ensures prompt replenishment of stocks. Keeps track of the store’s stock of medications and other healthcare supplies. Ensures proper practice of proper pharmacy procedures mandated by the Company and the government. Ensures proper and timely endorsement of return of bad orders to suppliers in coordination with merchandising and warehouse. Helps oversee the accurate and proper monitoring of Pharmacy stocks in the storage and display area. Coordinates with merchandising for stock ordering to support the store sales and service delivery. Ensures prompt replenishment of products in the Pharmacy Section. Implements proper handling procedure of merchandise against breakage or damage. Candidate must possess at least Bachelor's/College Degree, Professional License (Passed Board/Bar/Professional License Exam) in Pharmacy/Pharmacology or equivalent.",Not Specified,Not Specified,Not Specified,Not Specified,Medicine
Joblum,Temporary Remote Work* | Healthcare CSR | SYKES Priority Hour,Pharmacy,Sykes Philippines,2021-05-21,National Capital Reg,Contract,,Not Specified / In Description,Not Specified / In Description,"Want to have your application prioritized? Apply through SYKES' Priority Hour and get a phone interview (Monday to Friday) within 24 hours! Get hired today and start working from home* ASAP! *Disclaimer: Work-from-home setup is temporary. You will be required to report to our Worldwide Corporate Center site (Mandaluyong City) after the pandemic. Our recruitment team will discuss other employment details with you during your interview. WHY YOU SHOULD JOIN SYKES SYKES is the best company where you can work, learn and grow. We offer competitive salary and benefits packages, provide various learning, development and mentoring opportunities and put programs in place to promote career growth. As a multinational digital marketing and customer service global outsourcer, we partner with Global 2000 companies. That means that you get to work with the world’s biggest brands and industry leaders! Here are some of the other benefits of working in SYKES: Competitive salary, account-specific benefits and performance incentivesNight differential and night shift allowancesPaid sick and vacation leavesHMO coverage (medical and dental) for you, even during probationary period, and your qualified dependentsLife InsuranceStudy Assistance ProgramCool office spaces and employee-centric facilitiesAccessible locationsMentoring and development programs for career growth opportunitiesExclusive discounts in partner establishmentsCompany-sponsored interest clubsEmployee engagement activitiesVolunteer programsSYKES has been in the Philippines for more than 20 years and is considered the country’s first multinational contact center! *Terms and conditions apply. *The 25K* monthly package is inclusive of basic pay, incentives and allowances. The basic salary varies depending on your assessment. What are we looking for? Completed at least 2 years of college educationBPO experience is requiredBasic knowledge of computer usage and internet navigationExcellent English communication skillsAt least 25mbps internet speed and workspace suitable for work-at-home Disclaimer: Some hiring requirements are filled immediately. To check if this job opening is still available, you may send our team a message through 09778259999 following this format – JobStreet: <Inquiry>. -- ATTESTATION By submitting your application, you acknowledge that you have read and understood SYKES Recruitment and Privacy Policy (https://www.sykes.com/philippines/sykes-recruitment-and-privacy-policy/). You attest that the personal information you provided, such as, among others, those pertaining to your academic and professional qualifications are accurate, true, complete, and not misleading. In addition, you give your consent to SYKES to verify the information you have provided relative to your application. This includes checks with your previous employers, academic and/or professional institutions and other agencies as permitted by law. You further understand that SYKES is committed to ensuring the confidentiality of your personal data through the institution of appropriate legal, organizational, physical and technical measures to protect such data consistent with applicable privacy and data security laws. You confirm and consent to SYKES (i) collecting, processing and updating your personal data in connection with your employment application and the provision of services through the Sykes e-Recruitment (e-Rec) portal; (ii) publishing your personal data via SYKES e-Rec portal (iii) transferring of your personal data to Sykes affiliates, vendors and third parties in accordance with existing laws and regulations. You are also aware that you are entitled to know whether SYKES holds your personal data, that you have the right to access your personal data, and that you may request for its supplementation, correction, or deletion, in accordance with local laws, as may be applicable. However, you acknowledge that certain personal data may be exempt from such access, correction and deletion requests pursuant to applicable data protection laws and regulations. You confirm and consent to receiving alerts and notices from SYKES regarding important events, deadlines and schedules, HR announcements and other matters of interest related to your work application and possible employment with SYKES.",Not Specified,Not Specified,Not Specified,Not Specified,Medicine
Joblum,Phone Interview: Earn up to 26k + Retirement Plan|Call Center Analyst,Pharmacy,Citigroup Business Process Solutions Pte. Ltd.,2021-05-21,National Capital Reg,Not Specified,"26,000-33,000",Not Specified / In Description,Not Specified / In Description,"POSITION TITLE: CUSTOMER SOLUTIONS OFFICER (CSO) RESPONSIBILITIES:• Provide world class service excellence to clients by offering a consistent telephone banking experience• Attend to inbound and outbound telephone calls in accordance with standard operating procedures• Process online banking transactions which include financial entries and data maintenance• Identify opportunities to further enhance relationships with our existing clients REQUIREMENTS: • College Graduate of a Bachelor’s Degree or any 4-year Course • Call Center Experience is not required for applicants who completed Bachelor's Degree • Must have available Transcript of Records/Diploma/Certificate of Grades/Certificate of Graduation • Fluent in English and the ability to communicate daily with clients in English • Amenable working on shifting schedule, holidays, weekends & extended work hours • Amenable to working in BGC, Taguig • Applicants should be Filipino citizens or hold relevant residence status BENEFITS OF WORKING IN CITI:We offer a competitive salary package of 26K and other great benefits including:• HMO Health Insurance from day 1 for you and your unlimited qualified dependents• Life Insurance from day 1• Tuition Reimbursement• Retirement Plan• Staff Loan• Bereavement Assistance• You will also learn the basics of being a banker thru mastery of global banking and financial services of Citi• Opportunity to interface with multicultural clients across the globe (Speak with clients from US, UK, Australia & Singapore) CAREER GROWTH: • Citi Philippines will continue to grow and has unveiled its newest Citi Headquarters in BGC called the Citi Plaza • Be part of our pioneer or fast-growing teams of Customer Service Officers • In CBPS, there are team leaders, managers, operations heads who started as CSOs and were trained and developed from within. Enjoy talent development programs that can make you part of the future leaders of Citi CBPS MAY ASSIGN CANDIDATES TO DIFFERENT BUSINESSES BASED ON CANDIDATE PROFILES, AVAILABLE OPENINGS & BUSINESS NEEDS. APPLICANTS MUST BE WILLING TO WORK IN BONIFACIO GLOBAL CITY. *By applying to this job posting, I hereby authorize Citi, its authorized third parties, and its/their officers, directors, employees, agents, and third party service providers, to hold, use and otherwise process my data in connection with my job application.","26,000","33,000",Not Specified,Not Specified,Medicine
Joblum,Pharmacist,Pharmacy,Raya Regenerative and Preventive Inc.,2021-05-20,Makati City,Not Specified,,Not Specified / In Description,Not Specified / In Description,"We are looking for a licensed and experienced Pharmacist to join our growing medical team. Primary Responsibilities Lead the process of registering medical device, supplements and pharmaceuticals with the FDA Manage inventory of pharmaceuticals Required Skills Attention to detail Able to work with little supervision Able to execute and follow through on project deadlines",Not Specified,Not Specified,Not Specified,Not Specified,Medicine
Joblum,REGULATORY AFFAIRS OFFICER,Pharmacy,Terumo (Philippines) Corporation,2021-05-20,Laguna (Sta. Rosa City),Not Specified,"11,000-13,400",Not Specified / In Description,Not Specified / In Description,"JOB SUMMARY: Responsible for the preparation and submission of initial or renewal registrations and variation documents of medical device products in Philippine FDA. Handle customer queries and coordinates request to ensure they are met and provided in an efficient manner. Perform activities for getting new registrations and maintaining registrations as per business goals. QUALIFICATION: Graduate of BS Pharmacy or allied courses. Preferably with at least two (2) years work experience. Knwoledgeable in Device Labelling, Design Control, Risk Management, CSDT, Technical Documentation and MS Office Applications.","11,000","13,400",Not Specified,Not Specified,Medicine
Joblum,Pharmacist,Pharmacy,Apogee Laboratories Corp,2021-05-20,Pasig City,Not Specified,,Not Specified / In Description,Not Specified / In Description,"Job Summary Under the supervision of the Production Supervisor/Manager, manages production activities and company regulatory requirements with FDA. Implements production plan/targets according to cGMP. Supervises employees engage in manufacturing process and dispenses batches according to BMRs. Comfortable working in an SME. Duties Coordinates in planning and organizing the manufacturing process of the company. Implements operational manuals, production plans and programs. Ensures conformance of manufacturing processes with organizational objectives and polices with the coordination of Production Supervisor/Manager. Checks the availability of adequate raw and packing materials, utilities, filters and machine size parts. Fulfills the monthly and weekly production plans according to the schedule with the coordination of Production Supervisor/Manager. Monitors manufacturing activities in compliance with the requirements of cGMP. Ensures that all standard yield are maintained by production lines. Checks production process and production facilities. Ensures the general cleanliness and hygienic conditions of the manufacturing areas. Ensures that all production equipments are maintained in good working order. Assists in pilot scale trials of products under development. Ensures that there is discipline and good working culture among the staff. Makes sure the on job training of production personnel. Ensures the hygienic condition of production personnel. Ensures production people wear mask, gloves and shoes before entering into production. Prepares daily reports. Performs other duties as assigned by Production Supervisor/Manager. Efforts Required High mental effort is required; Good work ethic & being a team player; Requires physical effort for monitoring various processing operations and for trouble shooting activities; Requires visual efforts to accomplish documentation and other routine paper works. Working Conditions Exposed to dust of different chemicals, which might cause allergic reactions; Exposure to a manufacturing laboratory Job Specification Qualification: Licensed Pharmacist Team player and resourceful 1-2 years work experience experience in / exposure to cosmetic manufacturing technology is a plus 23 years Above",Not Specified,Not Specified,Not Specified,Not Specified,Medicine
Joblum,Pharmacy Analyst | Temporary WFH |  20K-22K,Pharmacy,"Nezda Technologies, Inc.",2021-05-20,National Capital Reg,Contract,"20,000-26,000",Not Specified / In Description,Not Specified / In Description,"Open for BS Pharmacy fresh graduate. TEMPORARY WFH! Must have personal laptop and stable internet connection. Must be amenable to work onsite. 20,000 - 22,000 basic salary. HMO on day 1 with 3 free dependents.","20,000","26,000",Not Specified,Not Specified,Medicine
Joblum,Licensed Pharmacist,Pharmacy,Cognizant Technology Solutions Philippines Inc.,2021-05-20,National Capital Reg,Full Time,"270,000",Not Specified / In Description,Not Specified / In Description,"Cognizant is a global organization serving clients across multiple industries with a deep set of offerings provided by our practice areas and supported by corporate and enabling functions. Employing roughly 270,000 talented associates worldwide, Cognizant is dedicated to anticipating and solving clients’ toughest problems and enabling them to thrive in the digital era. Join us and Be Cognizant! Educational & Job Qualifications: Must have a Bachelor’s degree in Pharmacy.Must have a license for Pharmacy.100% compliance to work allocated and leaves applications.Perform activities for the assigned project in a timely and efficient manner.Responsible for completion of day-to-day work and process flows within agreed service levels (SLA’s)Coordinate with internal teams to obtain necessary information required for day-to-day operationsWilling to attend ON SITE TRAINING sessions and develop capabilities on an ongoing basis.Willing to work in Taguig.Willing to work on a shifting schedule. Besides above industry-standard salary and clear career growth, you will also have HMO coverage* from day 1 of your job at Cognizant. The following are included in this benefit: Competitive medical coverage for the employee and family (parents, spouse, or domestic partner) **Medicine reimbursement for outpatientsMaternity assistanceLife, accidental death and dismemberment, and total permanent disability insuranceLaboratory, diagnostic and therapeutic proceduresAnnual Physical Exam (APE)DentalAccess to major hospitals","270,000","270,000",Not Specified,Not Specified,Medicine
Joblum,Branch Pharmacist- Davao,Pharmacy,Completesolution Pharmacy,2021-05-20,Davao,Full Time,"16,500-18,000",Not Specified / In Description,Not Specified / In Description,"To ensure compliance of the Good Manufacturing Practice (GMP) and Good Distribution Practice (GDP). I. Job duties and responsibilities: To ensure that all legal requirements from Food and Drug Authority (FDA), Department of Health (DOH), and Philippine Drug Enforcement Agency (PDEA) are updated, available, and systematically filed. To maintain summary of updated list of products and other pertinent record books required by FDA, DOH, PDEA and our company. To keep or maintain original record of sales, purchases, acquisitions and deliveries of regulated pharmaceutical drugs and submits report of transactions to the PDEA. To keep and maintain Dangerous Drugs Register and Controlled Chemical Register and records transaction within twenty-four (24) hours. To provide and implement safekeeping of dangerous drugs and chemicals. To notify PDEA for any loss or stolen dangerous and regulated drugs or controlled chemicals immediately for prompt action. To handle client’s queries, problems, issues and concerns related to the prescribed medications. To reports any untoward incidents to the Chief Pharmacist for proper action and resolution To make sure that Good Distribution Practices/Standard Operating Procedures (SOP) are observed and strictly implemented to all personnel involved. To spearhead the execution and implementation of effective and efficient warehouse management. To supervise warehouse personnel in terms of warehouse decisions and directions. To ensure strict compliance of proper handling and delivery of pharmaceutical products to different hospitals, clinics, patients to designated branches nationwide. Responsible in checking of stocks from the suppliers against invoice or delivery orders to spot the quantity, description discrepancies and damaged goods and verify the quality and condition of the stocks. To check all Goods Received Notes (GRN), purchased returns, borrowed stocks from the suppliers, purchase request, credit memo in QNE system. To monitor and document warehouse stocks accurately. Check stocks are properly labeled according to principal. To conduct regular inventory of stocks once-a-month and submit inventory report to the head office. To compare inventory count of stocks of QNE system versus actual stocks-on-hand. Maintains consistent and balance data between the system and actual physical count. To report NEAR EXPIRY and EXPIRED PRODUCTS to the respective principals and Chief Pharmacist. To ensure storage of pharmaceutical products are arrange in an orderly manner. To ensure that the storage areas of pharmaceutical products are maintained within required temperature. To ensure proper dispensing of quality drugs to the client, hospitals and satellite branches. To confirm/check receipt of stocks delivered by the principal and promptly report any damage and problems encountered for immediate resolution. To practice appropriate distribution and dispensing of pharmaceutical products to clients and strictly applying the “FIFO” and “FEFO” policy. To conduct meeting to the branch personnel to give necessary updates, reports and implements necessary changes. To constantly communicate and forward updated reports to the main branch. To ensure branch vicinity is clean and free from vermin at all times. To preserve integrity, dignity and worth of the CSP Company. To ensure that all trade returns are within the CSP policy Keep records of out-going and in-coming transactions of the branch. Promote and maintain good, long term customer relations. Maintains harmonious relationship among co-employees and clients. Suggests better ideas for the development of the department that can also result in performance improvement. Responding to inter-office and client emails concerning to warehouse department. Maintain positive work attitudes and be able to work harmoniously with other CSP employees. Other work-related tasks that may be assigned from time to time by the immediate superior. Qualifications: Candidate must possess at least Bachelor's/College Degree, Professional License (Passed Board/Bar/Professional License Exam) in Pharmacy/Pharmacology or equivalent. Must be a Licensed Pharmacist At least 1 Year(s) of working experience in the related field is required for this position. Preferably 1-4 Yrs Experienced Employee specialized in Healthcare - Pharmacy or equivalent.","16,500","18,000",Not Specified,Not Specified,Medicine
