Joblum,Regulatory Pharmacist,Pharmacy,"Biosite Medical Instruments, Inc.",2021-05-07,Davao,Full Time,"15,000-20,000",Not Specified / In Description,Not Specified / In Description,"Job Responsibilities: • Product registration of all products under Food & Drugs Agency Listings • Securing of Product Exemption Certificate for all those not requiring Certificate of Product Registration • Amendments of License to Operate as Medical Device distributor based on company/suppliers/principal regulatory requirements and updates • Any other regulatory certificate and licenses as required • Perform other related duties and responsibilities as may be required from time to time. Job Requirements: • Candidate must possess at least a Bachelor’s/College Degree, Professional License, Pharmacy/Pharmacology or equivalent. • At least 1 year(s) of working experience in the related field is required for this position • Full-time ","15,000","20,000",Not Specified,Not Specified,Medicine
Joblum,Retail Pharmacist | SM Dasmarinas,Pharmacy,TOTAL NUTRITION CORPORATION,2021-05-07,National Capital Reg,Full Time,,Not Specified / In Description,Not Specified / In Description,"Job Description Regulatory Analyst, Pharmacist Evaluate, Analyze, Prepare needed documents and other requirements for PRODUCT REGISTRATIONS (FOOD, DRUG & COSMETICS). To ensure and facilitate product compliance with FDA standards and regulations. Qualification Candidate must possess at least a Bachelor's/College DegreeMust be a Registered PharmacistAt least 1-3 years of experience in the related field is required for this positionMust be willing to be assigned in SM Dasma. Job Description Classifies products into either Food, Drug or Cosmetic and checks lacking documents for request.Facilitates Initial & Renewal Applications and Re-ApplicationsAssists in LTO applications (Initial, Renewal & FDA inspections)Submits & follows-up applications to FDA Alabang as advised by immediate superiorVisits warehouse & stores for actual product identificationReports regulatory concerns to immediate superiorPRC License will be usedAssists during FDA Inspection Perks and Benefits Paid HolidaysPaid Vacation LeavePaid Sick LeaveMaternity & Paternity LeaveSingle Parent LeaveSpecial Leave Benefits for WomenMedical / Health InsuranceEmployee Discounts Job Types: Full-time, Contract Application Questions You have requested that Indeed ask candidates the following questions: How many years of Regulatory experience do you have? Do you have the following license or certification: Pharmacist? ",Not Specified,Not Specified,Not Specified,Not Specified,Medicine
Joblum,Pharmacovigilance Safety Specialist-Clinical Pharmacist/30k-40k/Ortigas/WFH,Pharmacy,Not Specified,2021-05-07,National Capital Reg,Full Time,,Not Specified / In Description,Not Specified / In Description,"Qualifications: Candidate must possess at least a Bachelor's/College Degree , Professional License (Passed Board/Bar/Professional License Exam), Pharmacy/Pharmacology or equivalent. Required skill(s): pharmacovigilance, adverse drug reaction, drug safety, Excellent Communication Skills. At least 2 year(s) of working experience in the related field is required for this position. Preferably 1-4 Yrs Experienced Employees specializing in Healthcare - Pharmacy or equivalent. 15 Full-Time position(s) available. Job Description: Process Safety data from various sources according to applicable regulations, guidelines, StandardOperating procedures (SOPs) and project requirements. Perform Pharmacovigilance activities per project requirement including but not limited to, intakeand tracking incoming - Adverse Events(AE)/endpoint information determining initial/update status of incoming events Database entry including coding AE, Products, Medical history and labs, writing narratives, andother project activities as per internal/ project timelines. Assess Lifecycle Safety data for reportability to relevant authorities and report to regulatory authorities, ethics committees, institutional review boards, investigators, oversight groups per legislation, within timelines and in a format compatible to requirement.",Not Specified,Not Specified,Not Specified,Not Specified,Medicine
Joblum,Company Regulatory Pharmacist,Pharmacy,ENDOSOURCE ENTERPRISES,2021-05-07,Pateros City,Full Time,"15,000-21,000",Not Specified / In Description,Not Specified / In Description,FULL-TIME or PART-TIME Requirements: -PRC Licensed -With sufficient knowledge of FDA Regulations regarding Medical Devices Directive -With at least 2-Year Regulatory Experienced in Medical Devices -Attended FDA Training for QPIRA (Qualified Person in Industry Regulatory Affairs) Job Description: -Application and Renewal of FDA licenses and CPR -Responsible for managing all matters concerning FDA regulatory system and requirements -Communication and coordination with manufacturers for all regulatory related matters -Organizing and maintaining regulatory works and system,"15,000","21,000",Not Specified,Not Specified,Medicine
Joblum,Regulatory Pharmacist,Pharmacy,AMB HK Enterprises Inc.,2021-05-07,Pasig City,Not Specified,,Not Specified / In Description,Not Specified / In Description,"Qualifications: Candidate must possess at least Bachelor's/College Degree in Pharmacy/Pharmacology or equivalent. Preferably Less than 1 year experience specialized in Healthcare - Pharmacy or equivalent. Licensed Pharmacist Willing to under go training Willing to work in Bagong Ilog Pasig City Can start immediately. Fresh Graduates are welcome to apply. Duties and Responsibilities • Being responsible for ensuring compliance with applicable to FDA, government rules and regulation • Determine and communicate drug approval requirements • Compile and submit documents to regulatory agencies • Participate as a member of a regulatory team • May review drug promotional and advertising material to ensure that it is compliant with regulations • Respond to regulatory officials and meet deadlines",Not Specified,Not Specified,Not Specified,Not Specified,Medicine
Joblum,Work from Home* | Customer Care Representative | Healthcare Account,Pharmacy,Sykes Philippines,2021-05-07,National Capital Reg,Contract,,Not Specified / In Description,Not Specified / In Description,"Work, learn and grow with the Top Employer and BPO Company of the Year! *Disclaimer: Work-from-home setup is temporary. You will be required to report to our Worldwide Corporate Center site (Mandaluyong City) after the pandemic. Our recruitment team will discuss other employment details with you during your interview. WHY YOU SHOULD JOIN SYKES SYKES is the best company where you can work, learn and grow. We offer competitive salary and benefits packages, provide various learning, development and mentoring opportunities and put programs in place to promote career growth. As a multinational digital marketing and customer service global outsourcer, we partner with Global 2000 companies. That means that you get to work with the world’s biggest brands and industry leaders! Here are some of the other benefits of working in SYKES: Competitive salary, account-specific benefits and performance incentivesNight differential and night shift allowancesPaid sick and vacation leavesHMO coverage (medical and dental) for you, even during probationary period, and your qualified dependentsLife InsuranceStudy Assistance ProgramCool office spaces and employee-centric facilitiesAccessible locationsMentoring and development programs for career growth opportunitiesExclusive discounts in partner establishmentsCompany-sponsored interest clubsEmployee engagement activitiesVolunteer programsSYKES has been in the Philippines for more than 20 years and is considered the country’s first multinational contact center! *Terms and conditions apply. *The 25K* monthly package is inclusive of basic pay, incentives and allowances. The basic salary varies depending on your assessment. What are we looking for? Completed at least 2 years of college educationBPO experience is requiredBasic knowledge of computer usage and internet navigationCan communicate in EnglishAt least 25mbps internet speed and workspace suitable for work-at-home Disclaimer: Some hiring requirements are filled immediately. To check if this job opening is still available, you may send our team a message through 09778259999 following this format – JobStreet: <Inquiry>. -- ATTESTATION By submitting your application, you acknowledge that you have read and understood SYKES Recruitment and Privacy Policy (https://www.sykes.com/philippines/sykes-recruitment-and-privacy-policy/). You attest that the personal information you provided, such as, among others, those pertaining to your academic and professional qualifications are accurate, true, complete, and not misleading. In addition, you give your consent to SYKES to verify the information you have provided relative to your application. This includes checks with your previous employers, academic and/or professional institutions and other agencies as permitted by law. You further understand that SYKES is committed to ensuring the confidentiality of your personal data through the institution of appropriate legal, organizational, physical and technical measures to protect such data consistent with applicable privacy and data security laws. You confirm and consent to SYKES (i) collecting, processing and updating your personal data in connection with your employment application and the provision of services through the Sykes e-Recruitment (e-Rec) portal; (ii) publishing your personal data via SYKES e-Rec portal (iii) transferring of your personal data to Sykes affiliates, vendors and third parties in accordance with existing laws and regulations. You are also aware that you are entitled to know whether SYKES holds your personal data, that you have the right to access your personal data, and that you may request for its supplementation, correction, or deletion, in accordance with local laws, as may be applicable. However, you acknowledge that certain personal data may be exempt from such access, correction and deletion requests pursuant to applicable data protection laws and regulations. You confirm and consent to receiving alerts and notices from SYKES regarding important events, deadlines and schedules, HR announcements and other matters of interest related to your work application and possible employment with SYKES.",Not Specified,Not Specified,Not Specified,Not Specified,Medicine
Joblum,Company Regulatory Pharmacist,Pharmacy,ENDOSOURCE ENTERPRISES,2021-05-07,National Capital Reg,Full Time,"15,000-21,000",Not Specified / In Description,Not Specified / In Description,Full-Time or Part-Time Requirements: -PRC Licensed -With sufficient knowledge of FDA Regulations regarding Medical Devices Directive -With at least 2-Year Regulatory Experienced in Medical Devices -Attended FDA Training for QPIRA (Qualified Person in Industry Regulatory Affairs) Job Description: -Application and Renewal of LTO and CPR -Responsible for managing all matters concerning FDA regulatory system and requirements -Communication and coordination with manufacturers for all regulatory related matters -Organizing and maintaining regulatory works and system,"15,000","21,000",Not Specified,Not Specified,Medicine
Joblum,Research Development Assistant (Licensed Pharmacist),Pharmacy,Aldrtz Corporation,2021-05-07,Western Visayas,Not Specified,,Not Specified / In Description,Not Specified / In Description,"Job Qualifications Candidate must be a graduate of Bachelor of Science in Pharmacy. Must possess a high level of organizational skills. Good in communication skills both oral and written. Has the ability to work independently, meets deadlines, multi-tasking. PRC License is required. Job Duties and Responsibilities Develops or formulates new products in accordance with FDA and cosmetic regualtions and their global counterparts. Maintains awareness of competitive products and technical developments in related fields of science and market trends. Prepares samples as requested by customers, specifically the Product Development Unit (PDU) and Product Management Group (PMG). Responsible for preparation of raw materials, bulk, and finished product specifications, SOP's and manufacturing instructions. Conducts stability studies on all products being developed in accordance with the established stability study protocols.Ensures physical stability, efficacy, toxicological, microbiological testing and consumer appeal, processing capabilities and cost effectiveness. Makes and records observation, performs calculations, collections and prepares data for evaluation. Monitors pilot batch and scale up trials of new products. Maintains, calibrates, validates, monitors, and troubleshoots laboratory instruments. Participates indesigning and conducting investigational studies of atypical results. Personal responosbility for following safety rules, SOP's, GLP, and cGMP guidelines. Complies with company rules and regulations. Performs other functions as assigned by the superior from time to time or when the need arises. ",Not Specified,Not Specified,Not Specified,Not Specified,Medicine
Joblum,Research and Development Assistant,Pharmacy,Chic Centre Corporation,2021-05-07,Pasig City,Full Time,"20,000-23,000",Not Specified / In Description,Not Specified / In Description,"Primary Job Responsibilities 1. Manages activities in line with new product development and reformulation for existing products. 2. Prepares laboratory batch in accordance with product profile. 3. Develops packaging materials and establishes specification for new products. 4. Conducts product evaluation e.g. usage test, stability test to establish shelf life and other parameters. 5. Validates process to be employed for the new product and the equipment suitable for the process. 6. Prepares Master Formula, Packaging/Product Specification Sheet and other necessary documents prior to production of new or reformulated products. 7. Requests and monitors pilot production run (if necessary) 8. Responsible on monitoring of products during initial production run. 9. Retains production samples for monitoring and stability testing of new products 10. Prepares Product Information File of new products and endorse to Regulatory Affairs Officer. 11. Assists QC analyst for the analysis and/or acceptance of new incoming raw and packaging materials. 12. Conducts investigation on products with quality issue and recommends corrective actions. 13. Performs trade check for product quality checking and prepare necessary reports. General Job Responsibilities1. Ensures implementation of Good Laboratory and Housekeeping Practices, Good Manufacturing Practices and Good Documentation Practices2. Monitors, requests and conducts inventory of laboratory and office supplies.3. Request calibration and maintenance of instrument and equipment to ensure good quality of analytical results according to schedule4. Prepares other necessary reports or Memo regarding non-compliance to standard procedures or any issues with product quality related5. Provides assistance and should also perform extended Quality Control duties in the absence ofco-workers. JOB QUALIFICATIONS: Bachelor’s degree required, preferably Bachelor of Science in Pharmacy. Professional license is required. Team player with strong inter personal skills; Keen to details; Good organizational and decision-making skills; Preferably with 2 years of experience in similar position in manufacturing setting;","20,000","23,000",Not Specified,Not Specified,Medicine
Joblum,Regulatory Affairs Assistant,Pharmacy,"Macare Medicals, Inc.",2021-05-07,Quezon City,Not Specified,,Not Specified / In Description,Not Specified / In Description,Qualifications: Must have a Bachelor's Degree and Professional License in Pharmacy Related work experience in FDA handling product registration in a Healthcare industry is an advantage With experience in document control and related ISO 9001:2015 certified company is an advantage With experience as Pollution Control Officer is also an advantage With excellent communication skills and computer literate Can work with minimal supervision Fresh graduates are welcome to apply Can start immediately Summary of Job Responsibilities: Assist Regulatory Officer with FDA and other agencies for product registration and regulatory concerns,Not Specified,Not Specified,Not Specified,Not Specified,Medicine
Joblum,STAFF PHARMACIST - GLOBAL CITY,Pharmacy,St. Luke's Medical Center,2021-05-07,Taguig City,Full Time,,Not Specified / In Description,Not Specified / In Description,"Candidate must possess at least a Bachelor's/College Degree , Professional License (Passed Board/Bar/Professional License Exam), Pharmacy/Pharmacology or equivalent. Willing to undergo a training program. With active PRC license. Highly motivated and results-oriented individual. Applicants must be willing to work in Quezon City Applicants should be Filipino citizens or hold relevant residence status. Full-Time position(s) available.",Not Specified,Not Specified,Not Specified,Not Specified,Medicine
Joblum,"SYKES Priority Hour | Customer Support (Healthcare) | 20,000* Signing Bonus",Pharmacy,Sykes Philippines,2021-05-06,National Capital Reg,OJT,,Not Specified / In Description,Not Specified / In Description,"Want to have your application prioritized? Apply through SYKES' Priority Hour and get a phone interview (Monday to Friday) within 24 hours! WHY YOU SHOULD JOIN SYKES SYKES is the best company where you can work, learn and grow. We offer competitive salary and benefits packages, provide various learning, development and mentoring opportunities and put programs in place to promote career growth. As a multinational digital marketing and customer service global outsourcer, we partner with Global 2000 companies. That means that you get to work with the world’s biggest brands and industry leaders! Here are some of the other benefits of working in SYKES: Competitive salary, account-specific benefits and performance incentivesNight differential and night shift allowancesPaid sick and vacation leavesHMO coverage (medical and dental) for you, even during probationary period, and your qualified dependentsLife InsuranceStudy Assistance ProgramCool office spaces and employee-centric facilitiesAccessible locationsMentoring and development programs for career growth opportunitiesExclusive discounts in partner establishmentsCompany-sponsored interest clubsEmployee engagement activitiesVolunteer programsSYKES has been in the Philippines for more than 20 years and is considered the country’s first multinational contact center! *Terms and conditions apply. *The 25K* monthly package is inclusive of basic pay, incentives and allowances. The basic salary varies depending on your assessment. What are we looking for? Completed at least 2 years of college educationBPO experience is requiredBasic knowledge of computer usage and internet navigationExcellent English communication skillsWilling to work in Shaw, Mandaluyong Disclaimer: Some hiring requirements are filled immediately. To check if this job opening is still available, you may send our team a message through 09778259999 following this format – JobStreet: <Inquiry>. -- ATTESTATION By submitting your application, you acknowledge that you have read and understood SYKES Recruitment and Privacy Policy (https://www.sykes.com/philippines/sykes-recruitment-and-privacy-policy/). You attest that the personal information you provided, such as, among others, those pertaining to your academic and professional qualifications are accurate, true, complete, and not misleading. In addition, you give your consent to SYKES to verify the information you have provided relative to your application. This includes checks with your previous employers, academic and/or professional institutions and other agencies as permitted by law. You further understand that SYKES is committed to ensuring the confidentiality of your personal data through the institution of appropriate legal, organizational, physical and technical measures to protect such data consistent with applicable privacy and data security laws. You confirm and consent to SYKES (i) collecting, processing and updating your personal data in connection with your employment application and the provision of services through the Sykes e-Recruitment (e-Rec) portal; (ii) publishing your personal data via SYKES e-Rec portal (iii) transferring of your personal data to Sykes affiliates, vendors and third parties in accordance with existing laws and regulations. You are also aware that you are entitled to know whether SYKES holds your personal data, that you have the right to access your personal data, and that you may request for its supplementation, correction, or deletion, in accordance with local laws, as may be applicable. However, you acknowledge that certain personal data may be exempt from such access, correction and deletion requests pursuant to applicable data protection laws and regulations. You confirm and consent to receiving alerts and notices from SYKES regarding important events, deadlines and schedules, HR announcements and other matters of interest related to your work application and possible employment with SYKES.",Not Specified,Not Specified,Not Specified,Not Specified,Medicine
Joblum,Open to Starter | Healthcare Account | Voice and Email Support,Pharmacy,Sykes Philippines,2021-05-06,National Capital Reg,OJT,,Not Specified / In Description,Not Specified / In Description,"Work, learn and grow with the Top Employer and BPO Company of the Year! WHY YOU SHOULD JOIN SYKES SYKES is the best company where you can work, learn and grow. We offer competitive salary and benefits packages, provide various learning, development and mentoring opportunities and put programs in place to promote career growth. As a multinational digital marketing and customer service global outsourcer, we partner with Global 2000 companies. That means that you get to work with the world’s biggest brands and industry leaders! Here are some of the other benefits of working in SYKES: Competitive salary, account-specific benefits and performance incentivesNight differential and night shift allowancesPaid sick and vacation leavesHMO coverage (medical and dental) for you, even during probationary period, and your qualified dependentsLife InsuranceStudy Assistance ProgramCool office spaces and employee-centric facilitiesAccessible locationsMentoring and development programs for career growth opportunitiesExclusive discounts in partner establishmentsCompany-sponsored interest clubsEmployee engagement activitiesVolunteer programsSYKES has been in the Philippines for more than 20 years and is considered the country’s first multinational contact center! *Terms and conditions apply. What are we looking for? Completed at least 2 years of college educationNo BPO experience neededBasic knowledge of computer usage and internet navigationCan communicate in EnglishWilling to report to our Worldwide Corporate Center site (Mandaluyong City) Disclaimer: Some hiring requirements are filled immediately. To check if this job opening is still available, you may send our team a message through 09778259999 following this format – JobStreet: <Inquiry>. -- ATTESTATION By submitting your application, you acknowledge that you have read and understood SYKES Recruitment and Privacy Policy (https://www.sykes.com/philippines/sykes-recruitment-and-privacy-policy/). You attest that the personal information you provided, such as, among others, those pertaining to your academic and professional qualifications are accurate, true, complete, and not misleading. In addition, you give your consent to SYKES to verify the information you have provided relative to your application. This includes checks with your previous employers, academic and/or professional institutions and other agencies as permitted by law. You further understand that SYKES is committed to ensuring the confidentiality of your personal data through the institution of appropriate legal, organizational, physical and technical measures to protect such data consistent with applicable privacy and data security laws. You confirm and consent to SYKES (i) collecting, processing and updating your personal data in connection with your employment application and the provision of services through the Sykes e-Recruitment (e-Rec) portal; (ii) publishing your personal data via SYKES e-Rec portal (iii) transferring of your personal data to Sykes affiliates, vendors and third parties in accordance with existing laws and regulations. You are also aware that you are entitled to know whether SYKES holds your personal data, that you have the right to access your personal data, and that you may request for its supplementation, correction, or deletion, in accordance with local laws, as may be applicable. However, you acknowledge that certain personal data may be exempt from such access, correction and deletion requests pursuant to applicable data protection laws and regulations. You confirm and consent to receiving alerts and notices from SYKES regarding important events, deadlines and schedules, HR announcements and other matters of interest related to your work application and possible employment with SYKES.",Not Specified,Not Specified,Not Specified,Not Specified,Medicine
