Website,Job Title,Category,Company,Date Posted,Location,Status,Salary,Education,Years of Work Experience,Job Description,Min Salary,Max Salary,Min Years of Work Experience,Max Years of Work Experience,Field
Joblum,Pharmacist,Pharmacy,Farmacia ni Dok-Calamba Branch,2021-05-30,Laguna (Calamba City),Not Specified,"12,000-16,800",Not Specified / In Description,Not Specified / In Description,"experienced in handling retail or community pharmacy must be self-driven in a community pharmacy Dispensing or supervising the dispensation of medications and related supplies, according to physicians' prescriptions Counseling patients regarding appropriate use of medications","12,000","16,800",Not Specified,Not Specified,Medicine
Joblum,REGULATORY PHARMACIST (ENTRY LEVEL),Pharmacy,Despina Pharma Inc,2021-05-29,National Capital Reg,Not Specified,"18,000-23,000",Not Specified / In Description,Not Specified / In Description,"Candidate must possess at least Professional License (Passed Board/Bar/Professional License Exam) in Pharmacy/Pharmacology or equivalent. At least 1 Year(s) of working experience in the related field is required for this position. With Good Oral & Written Communication Skill. Willing to start Immediately. Knowledgeable in Food Product Registration and Labeling of food and pharmaceutical products is essential. Hard-working, Career-oriented, and eager to learn. *Right candidate could avail free company accommodation","18,000","23,000",Not Specified,Not Specified,Medicine
Joblum,PHARMACIST for TARLAC,Pharmacy,"Watsons Personal Care Stores (Philippines), Inc.",2021-05-29,"Tarlac, National Capital Reg",Full Time,,Not Specified / In Description,Not Specified / In Description,"JOB SUMMARY: The Pharmacist is responsible for dispensing, giving medicine information and monitoring drug therapies. He/ She works to legal and ethical guidelines to ensure correct and safe supply of medicines to the general public. The position is also responsible for the delivery of all regulatory compliance and commercial result of the Drugstore through management of day-to-day operations and implementation of Good Pharmacy Practice (Store Environment, Dispensing Process, Health and Wellness Advocacy and Regulatory Requirements). JOB REQUIREMENTS: • Candidate must possess at least a Bachelor's/College Degree, Professional License (Passed Board/Bar/Professional License Exam), Pharmacy/Pharmacology or equivalent. • Required skill(s): leadership skill, RETAIL PHARMACY OPERATION. • No work experience required. • 2 Full-Time position available.",Not Specified,Not Specified,Not Specified,Not Specified,Medicine
Joblum,Pharmacist,Pharmacy,Springfield Pharma And Medical Supplies Inc.,2021-05-29,Quezon City,Not Specified,,Not Specified / In Description,Not Specified / In Description,"Responsibilities: Organize the pharmacy in an efficient manner to make the identification of products easier and faster Maintain full control over delivering, stocking and labeling medicine and other products and monitor their condition to prevent expiring or deterioration Listen carefully to customers to interpret their needs and issues and offer information and advice Provide assistance other medical services such as injections, blood pressure/ temperature measurements etc. Requirements: Proven experience as a pharmacist Thorough understanding of dosage administration and measurement, chemical compounds, medical brands etc. Good organizing skills Excellent communication skills with a customer oriented approach",Not Specified,Not Specified,Not Specified,Not Specified,Medicine
Joblum,(3) LICENSED PHARMACIST,Pharmacy,"Euro Health Care Exponents, Inc.",2021-05-29,Quezon City,Full Time,,Not Specified / In Description,Not Specified / In Description,"Candidate must possess at least Professional License (Passed Board/Bar/Professional License Exam) in Pharmacy/Pharmacology or equivalent. Prefably for Fresh Grad Required Skill(s): 1. Knowledgeable in MS. Office, 2. Adobe Photoshop and Corel Draw 3. Application, Knowledgeable in FDA Liason, Scope of Work (REGULATORY PHARMACIST)",Not Specified,Not Specified,Not Specified,Not Specified,Medicine
Joblum,Pharmacist - Mervillle Parañaque City,Pharmacy,Ambica International Corporation,2021-05-29,Paranaque City,OJT,,Not Specified / In Description,Not Specified / In Description,"Job Description: Responsible for ensuring the correctness and compliance of the documents per FDA Guidelines for the Initial Applications and Biologicals Drug Applications upon submission to FDA to merit approval and secure a Certificate of Product Registration. Responsible for having follow-ups for the applications that were not yet evaluated by the FDA for timely release of approval from the FDA. Able to submit compliance on or before the deadline as prescribed by the FDA. Prepares documents for PCPR and CLIDP Extensions. Job Requirements: A graduate of B.S. Pharmacy Registered Pharmacist With good communication skills, hardworking and flexible Willing to work in Merville Park Subd., Paranaque City",Not Specified,Not Specified,Not Specified,Not Specified,Medicine
Joblum,Healthcare Advocate | Customer Service | Weekends Off,Pharmacy,Sykes Philippines,2021-05-29,National Capital Reg,Contract,,Not Specified / In Description,Not Specified / In Description,"Get hired today and start working from home* ASAP! *Disclaimer: Work-from-home setup is temporary. You will be required to report to our Glorietta 1 site (Makati City) after the pandemic. Our recruitment team will discuss other employment details with you during your interview. WHY YOU SHOULD JOIN SYKES SYKES is the best company where you can work, learn and grow. We offer competitive salary and benefits packages, provide various learning, development and mentoring opportunities and put programs in place to promote career growth. As a multinational digital marketing and customer service global outsourcer, we partner with Global 2000 companies. That means that you get to work with the world’s biggest brands and industry leaders! Here are some of the other benefits of working in SYKES: Competitive salary, account-specific benefits and performance incentivesNight differential and night shift allowancesPaid sick and vacation leavesHMO coverage (medical and dental) for you, even during probationary period, and your qualified dependentsLife InsuranceStudy Assistance ProgramCool office spaces and employee-centric facilitiesAccessible locationsMentoring and development programs for career growth opportunitiesExclusive discounts in partner establishmentsCompany-sponsored interest clubsEmployee engagement activitiesVolunteer programsSYKES has been in the Philippines for more than 20 years and is considered the country’s first multinational contact center! *Terms and conditions apply. *The compensation package is inclusive of incentives and allowances. The basic salary varies depending on your assessment. What are we looking for? At least K-12 graduate or completed at least 2 years of college educationHealthcare (BPO) background is requiredBasic knowledge of computer usage and internet navigationCan communicate in EnglishAt least 25mbps internet speed and workspace suitable for work-at-home Disclaimer: Some hiring requirements are filled immediately. To check if this job opening is still available, you may send our team a message through 09778259999 following this format – JobStreet: <Inquiry>. -- ATTESTATION By submitting your application, you acknowledge that you have read and understood SYKES Recruitment and Privacy Policy (https://www.sykes.com/philippines/sykes-recruitment-and-privacy-policy/). You attest that the personal information you provided, such as, among others, those pertaining to your academic and professional qualifications are accurate, true, complete, and not misleading. In addition, you give your consent to SYKES to verify the information you have provided relative to your application. This includes checks with your previous employers, academic and/or professional institutions and other agencies as permitted by law. You further understand that SYKES is committed to ensuring the confidentiality of your personal data through the institution of appropriate legal, organizational, physical and technical measures to protect such data consistent with applicable privacy and data security laws. You confirm and consent to SYKES (i) collecting, processing and updating your personal data in connection with your employment application and the provision of services through the Sykes e-Recruitment (e-Rec) portal; (ii) publishing your personal data via SYKES e-Rec portal (iii) transferring of your personal data to Sykes affiliates, vendors and third parties in accordance with existing laws and regulations. You are also aware that you are entitled to know whether SYKES holds your personal data, that you have the right to access your personal data, and that you may request for its supplementation, correction, or deletion, in accordance with local laws, as may be applicable. However, you acknowledge that certain personal data may be exempt from such access, correction and deletion requests pursuant to applicable data protection laws and regulations. You confirm and consent to receiving alerts and notices from SYKES regarding important events, deadlines and schedules, HR announcements and other matters of interest related to your work application and possible employment with SYKES.",Not Specified,Not Specified,Not Specified,Not Specified,Medicine
Joblum,Retail Pharmacist| Robinson Antipolo,Pharmacy,TOTAL NUTRITION CORPORATION,2021-05-29,National Capital Reg,Full Time,,Not Specified / In Description,Not Specified / In Description,"Job Description Responsible for assisting clients for product informationProvide our customers the best shopping experience.Conduct strategic planning cost control and tactical execution measures to attain regional goalsProvide assistance in coordination, research and preparation of in-depth regulatory evaluation for current assets and businesses Minimum Qualifications Excellent communication skillsMust be a REGISTERED PHARMACISTPassionate for daily customer relationshipWilling to work on shifting schedule (Mall hours)Willing to work in Robinson AntipoloAt least 1-3 years’ experience in retail Perks and Benefits  Paid Vacation Leave Paid Sick Leave Paid Bereavement/Family Leave Maternity & Paternity Leave Single Parent Leave Special Leave Benefits for Women Medical / Health Insurance Employee Discounts Performance Bonus Job Types: Full-time, Contract Application Questions You have requested that Indeed ask candidates the following questions: How many years of Pharmacy experience do you have?How many years of Retail Sales Associate experience do you have?Do you have the following license or certification: Registered Pharmacist?Do you speak English?",Not Specified,Not Specified,Not Specified,Not Specified,Medicine
Joblum,Corporate Pharmacist,Pharmacy,Elevatione Time Stops,2021-05-28,Makati City,Contract,"18,000-25,000",Not Specified / In Description,Not Specified / In Description,"DESCRIPTION: The Pharmacist will also act as a Regulatory affairs officer in FDA that ensures all products of the company meet legislative requirements. It’s main responsibility also to update and organized all related document and literature regarding the business products. QUALIFICATIONS: • At least 1 year experience in the same line of job. • A licensed Pharmacist • Willing to work as part time • Has an experience in government requirement regarding company compliance like FDA, and all related government compliance permits. • Administrative writing, data analysis and reporting skills • The ability to understand, follow, recommend and create company policies and procedures related to the line of job. • Eager to learn and work together with other departments in the company. • Possess strong leadership skills, people-person, and critical-thinker, problem solving abilities, analytical skills, mathematical skills and creative thinking skills. • Proactive, detail-oriented, organized, accurate, and can work with minimum supervision, can follow standard procedure and decision making. • Excellent verbal, copy writing and business-writing communication skills. • Proficiency in Microsoft Office Software, Excellent MS Excel or administrative system is an advantage. • Positive working attitude and observe professionalism at all times that can embodied the company’s vision and mission. Cope well under pressure and time management. RESPONSIBILITIES: • Fulfills tasks set out by the Management. • Oblige to be involved with all business entities connected to the company. • Follows the company rules, regulations and guidelines. • Securing pertinent documents related to business permits and government compliance. • Handles all government requirement regarding company compliance like FDA, and all related to government compliance permits. • License will be solely for the company for yearly contract in FDA. • Maintaining familiarity with company product ranges to the organization and direct handling personnel. • Planning, undertaking and overseeing product trials and regulatory inspections as well as updates • Keeping up to date with changes in regulatory legislation and guidelines • Analyzing complicated information, including trial data • Liaising and negotiating with regulatory authorities • Assists in the full inventory of the company products. • Keeping accurate customer records. • Ensuring a safe and clean working environment. • Completing operational requirements of the pharmacy, including verifying order entries, maintaining records of controlled substances, charges, and removing expired and/or damaged drugs from the pharmacy’s inventory. • Adhering to applicable legal rules, regulations, and procedures governing pharmaceutical practice. • Ensuring that quality standards are met and submissions meet strict deadlines • Handles special projects that may be assigned from time to time. • Performs related accountabilities/responsibilities as required or directed","18,000","25,000",Not Specified,Not Specified,Medicine
Joblum,Regulatory Pharmacist - Mervillle Parañaque City,Pharmacy,Ambica International Corporation,2021-05-28,Paranaque City,OJT,,Not Specified / In Description,Not Specified / In Description,"Job Description: Responsible for ensuring the correctness and compliance of the documents per FDA Guidelines for the Initial Applications and Biologicals Drug Applications upon submission to FDA to merit approval and secure a Certificate of Product Registration. Responsible for having follow-ups for the applications that were not yet evaluated by the FDA for timely release of approval from the FDA. Able to submit compliance on or before the deadline as prescribed by the FDA. Prepares documents for PCPR and CLIDP Extensions. Job Requirements: A graduate of B.S. Pharmacy Registered Pharmacist With good communication skills, hardworking and flexible Willing to work in Merville Park Subd., Paranaque City",Not Specified,Not Specified,Not Specified,Not Specified,Medicine
Joblum,PHARMACY ASSISTANT for SAN FRANCISO AGUSAN DEL SUR,Pharmacy,"Watsons Personal Care Stores (Philippines), Inc.",2021-05-28,Agusan del Sur,Full Time,,Not Specified / In Description,Not Specified / In Description,"JOB SUMMARY: The Pharmacy Assistant helps the Pharmacist in front operations (dispensing, selling, cashiering and delivering good customer service) and back operations functions (stock management and other retail processes) appropriate to their level. He/ She is expected to serve customer is a Fast, Accurate, Convenient, Informative and Personalized Service following the Dispensing Guidelines, Service & Selling Standards and always refer any questions regarding prescriptions, drug information or health matters to the Pharmacist. JOB REQUIREMENTS: Candidate must possess at least a Bachelor's/College Degree, Biology, Nursing, Others, Pharmacy/Pharmacology, Psychology or equivalent.Required skill(s): cashiering, customer service, RETAIL PHARMACY.No work experience required.2 Full-Time position(s) available.",Not Specified,Not Specified,Not Specified,Not Specified,Medicine
Joblum,Registered Pharmacist,Pharmacy,Apollo Drugstore and Diagnostic Center Inc.,2021-05-28,Batangas,Not Specified,"20,000-26,000",Not Specified / In Description,Not Specified / In Description,"Job Qualifications: Candidates must possess at least Bachelor's/College Degree, Professional License (Passed Board/Bar/Professional License Exam) in Pharmacy/Pharmacology or equivalent. At least 4 Year(s) of working experience in the related field is required for this position. Preferably 1-4 Yrs Experienced Employee specialized in Healthcare - Pharmacy or equivalent. Excellent interpersonal skills Good communication skills Strong customer oriented abilities Knowledge in computer software (POS) Maintains professional attitude in manner and in appearance. Job Duties: Monitoring customers’ drug therapies, advising interventions, and informing customers of any potential side effects. Instructing customers on how and when to take prescribed medications. Keeping accurate customer records. Ensuring a safe and clean working environment. Completing operational requirements of the pharmacy, including verifying order entries, maintaining records of controlled substances, charges, and removing expired and/or damaged drugs from the pharmacy’s inventory. Adhering to applicable legal rules, regulations, and procedures governing pharmaceutical practice. Performing other administrative tasks when needed.","20,000","26,000",Not Specified,Not Specified,Medicine
Joblum,PHARMACY ASSISTANT for  TAGUM CITY,Pharmacy,"Watsons Personal Care Stores (Philippines), Inc.",2021-05-28,"Davao del Norte, Davao del Sur (Davao City)",Full Time,,Not Specified / In Description,Not Specified / In Description,"JOB SUMMARY: The Pharmacy Assistant helps the Pharmacist in front operations (dispensing, selling, cashiering and delivering good customer service) and back operations functions (stock management and other retail processes) appropriate to their level. He/ She is expected to serve customer is a Fast, Accurate, Convenient, Informative and Personalized Service following the Dispensing Guidelines, Service & Selling Standards and always refer any questions regarding prescriptions, drug information or health matters to the Pharmacist. JOB REQUIREMENTS: Candidate must possess at least a Bachelor's/College Degree, Biology, Nursing, Others, Pharmacy/Pharmacology, Psychology or equivalent.Required skill(s): cashiering, customer service, RETAIL PHARMACY.No work experience required.2 Full-Time position(s) available.",Not Specified,Not Specified,Not Specified,Not Specified,Medicine
Joblum,REGULATORY PHARMACIST,Pharmacy,"Phil Pharmawealth, Inc.",2021-05-28,Pasig City,Not Specified,"20,000-28,000",Not Specified / In Description,Not Specified / In Description,"To function as Drug, Medical Device, Cosmetics, Food (Distributor/Importer/Wholesaler) Pharmacist; To oversee that the License to Operate certificates are renewed according to FDA standards and requirements; To follow or comply whenever a drug product is to undergo Registration, shelf-life, Extension and Batch Certification, in accordance with FDA standards and requirements; To notify the FDA in case of changes made in the status of business; To do field/liaison work as the need arises; and To perform other related duties as may be assigned by the immediate superior.","20,000","28,000",Not Specified,Not Specified,Medicine
Joblum,Branch Pharmacist - FERJ AVENIDA,Pharmacy,"Phil Pharmawealth, Inc.",2021-05-28,Manila City,Full Time,"15,000-19,500",Not Specified / In Description,Not Specified / In Description,"Qualification: 1.Candidate must possess at least Professional License (Passed Board/Bar/Professional License Exam) in Pharmacy/Pharmacology or equivalent. 2.Required Skill(s): EXCELLENT MANAGEMENT SKILLS 3.Preferably 1-4 Yrs Experienced Employee specialized in Healthcare - Pharmacy or equivalent. 4.Willing to start asap. Job Responsibilities: 1.Maintain valid update records of the following documents as required by FDA; 2.Process the renewal of License to Operate (LTO); 3.Oversee the work of the Stockman, Inventory Management Staff, Deliveryman, and Drivers; 4.Oversee the maintenance of all company properties, sanitation, and hygiene; 5.Make and Submit reports as required by Regulatory Department; 6.Conduct lecture on Proper Product Handling and Good Storage Practice; 7.Conduct regular evaluation and exams for all personnel.","15,000","19,500",Not Specified,Not Specified,Medicine
Joblum,Regulatory Pharmacist,Pharmacy,JackPharma Inc.,2021-05-28,San Juan City,Contract,,Not Specified / In Description,Not Specified / In Description,"Job Description Renewal officer for FDA affairs; renewal of licenses LTO and other regulatory licenses, facilitates timely registration of products at FDA, preparation of product requirements from FDA registration Provide the company with technical expertise necessary for the improvement of management functions Demonstrate skills and knowledge in contemporary pharmacy practice Qualifications Bachelor's degree in pharmacy with professional liscense Good oral and written communication skills With necessary working experience in the related field",Not Specified,Not Specified,Not Specified,Not Specified,Medicine
Joblum,PHARMACIST for SAN NICOLAS ILOCOS NORTE,Pharmacy,"Watsons Personal Care Stores (Philippines), Inc.",2021-05-28,Ilocos Norte,Full Time,,Not Specified / In Description,Not Specified / In Description,"JOB SUMMARY: The Pharmacist is responsible for dispensing, giving medicine information and monitoring drug therapies. He/ She works to legal and ethical guidelines to ensure correct and safe supply of medicines to the general public.The position is also responsible for the delivery of all regulatory compliance and commercial result of the Drugstore through management of day-to-day operations and implementation of Good Pharmacy Practice (Store Environment, Dispensing Process, Health and Wellness Advocacy and Regulatory Requirements). JOB REQUIREMENTS: • Candidate must possess at least a Bachelor's/College Degree, Professional License (Passed Board/Bar/Professional License Exam), Pharmacy/Pharmacology or equivalent.• Required skill(s): leadership skill, RETAIL PHARMACY OPERATION.• No work experience required.• 2 Full-Time position available.",Not Specified,Not Specified,Not Specified,Not Specified,Medicine
Joblum,"Licensed Pharmacist - AllDay Rx (General Trias, Cavite)",Pharmacy,All Value Holdings Corp.,2021-05-28,Cavite,Full Time,,Not Specified / In Description,Not Specified / In Description,"RESPONSIBILITIES • Manage daily store operations efficiently by providing Good Leadership and Motivation to the team. • Dispense right medications based on the prescription/s given by the physician/doctor. • Provide Excellent Customer Service by counseling customers through interpreting/reviewing prescription/s. • Maintain clean and safe working environment by ensuring accurate inventory management. • Perform other related tasks from time to time. QUALIFICATIONS• Pharmacy graduate with License.• With at least 1 year of experience in Community Pharmacy.• Willing to be assigned in AllDay General Trias Cavite, Cavite• Full-Time Position(s) available.• FRESH BOARD PASSERS ARE WELCOME TO APPLY!",Not Specified,Not Specified,Not Specified,Not Specified,Medicine
Joblum,PHARMACY ASSISTANT for SAN NICOLAS ILOCOS NORTE,Pharmacy,"Watsons Personal Care Stores (Philippines), Inc.",2021-05-28,Ilocos Norte,Not Specified,,Not Specified / In Description,Not Specified / In Description,"JOB SUMMARY: The Pharmacy Assistant helps the Pharmacist in front operations (dispensing, selling, cashiering and delivering good customer service) and back operations functions (stock management and other retail processes) appropriate to their level. He/ She is expected to serve customer is a Fast, Accurate, Convenient, Informative and Personalized Service following the Dispensing Guidelines, Service & Selling Standards and always refer any questions regarding prescriptions, drug information or health matters to the Pharmacist. JOB REQUIREMENTS: Candidate must possess at least a Bachelor's/College Degree, Biology, Nursing, Others, Pharmacy/Pharmacology, Psychology or equivalent.Required skill(s): cashiering, customer service, RETAIL PHARMACY.No work experience required.",Not Specified,Not Specified,Not Specified,Not Specified,Medicine
Joblum,Licensed Pharmacist - AllDay Rx (Bacoor East Cavite),Pharmacy,All Value Holdings Corp.,2021-05-28,Cavite,Full Time,,Not Specified / In Description,Not Specified / In Description,RESPONSIBILITIES Manage daily store operations efficiently by providing Good Leadership and Motivation to the team. Dispense right medications based on the prescription/s given by the physician/doctor. Provide Excellent Customer Service by counseling customers through interpreting/reviewing prescription/s. Maintain clean and safe working environment by ensuring accurate inventory management. Perform other related tasks from time to time. QUALIFICATIONS Pharmacy graduate with License. With at least 1 year of experience in Community Pharmacy. Preferably with experience in Opening Stores. Willing to be assigned in Camella Bacoor East. Full-Time Position(s) available. FRESH GRADUATES WITH LICENSE ARE WELCOME TO APPLY!,Not Specified,Not Specified,Not Specified,Not Specified,Medicine
