Joblum,PHARMACY ASSISTANT (ALABANG),Pharmacy,MerryMart Grocery Centers Inc,2021-05-14,National Capital Reg,Not Specified,,Not Specified / In Description,Not Specified / In Description,"Pharmacy Assistant Job Duties: Dispenses prescription medication and other medical products to patients under direction of licensed pharmacist Counts pills, labels bottles, prices, and compounds medications to prepare prescriptions for patients as directed Performs administrative duties, including answering phones, receiving and inputting prescription orders, operating cash registers, and restocking inventory Gathers, organises, and assesses patient information Supplies patients with information and education on their prescriptions Monitors prescription-filling process to ensure compliance with relevant regulations and pharmacy policies Liaises with healthcare providers and patients to obtain correct prescription information Answers patients' questions about their medications under the supervision of the pharmacist Takes inventory of drugs on hand and records results Places orders for additional drugs as directed by the pharmacist Maintains electronic patient information Prepares billing information for medications Completes patients' sales transactions for purchase of prescription and over-the-counter medications as well as other pharmaceutical products Detail-Oriented, Works Well with a Team, Strong Customer-Service Skills, Excellent Verbal Communication Skills, Good Listener, Follows Instructions Well, Discreet, Organisational Skills, Mathematical Skills, Strong Scientific Skills, Excellent Memorisation Skills, Adaptive Learner, Computer Skills, Knowledge of Drug Regulations, Multi-Tasking Skills, Record-Keeping Ability",Not Specified,Not Specified,Not Specified,Not Specified,Medicine
Joblum,PHARMACY ASSISTANT (MAKATI),Pharmacy,MerryMart Grocery Centers Inc,2021-05-14,National Capital Reg,Not Specified,,Not Specified / In Description,Not Specified / In Description,"Pharmacy Assistant Job Duties: Dispenses prescription medication and other medical products to patients under direction of licensed pharmacist Counts pills, labels bottles, prices, and compounds medications to prepare prescriptions for patients as directed Performs administrative duties, including answering phones, receiving and inputting prescription orders, operating cash registers, and restocking inventory Gathers, organises, and assesses patient information Supplies patients with information and education on their prescriptions Monitors prescription-filling process to ensure compliance with relevant regulations and pharmacy policies Liaises with healthcare providers and patients to obtain correct prescription information Answers patients' questions about their medications under the supervision of the pharmacist Takes inventory of drugs on hand and records results Places orders for additional drugs as directed by the pharmacist Maintains electronic patient information Prepares billing information for medications Completes patients' sales transactions for purchase of prescription and over-the-counter medications as well as other pharmaceutical products Detail-Oriented, Works Well with a Team, Strong Customer-Service Skills, Excellent Verbal Communication Skills, Good Listener, Follows Instructions Well, Discreet, Organisational Skills, Mathematical Skills, Strong Scientific Skills, Excellent Memorisation Skills, Adaptive Learner, Computer Skills, Knowledge of Drug Regulations, Multi-Tasking Skills, Record-Keeping Ability",Not Specified,Not Specified,Not Specified,Not Specified,Medicine
Joblum,Licensed Pharmacist - Las Piñas (Urgent Hiring),Pharmacy,2MG Incorporated,2021-05-14,Las Pinas City,OJT,"16,000-18,000",Not Specified / In Description,Not Specified / In Description,"GetMEDS Online Pharmacy is an innovative healthcare technology company based in Las Piñas City with a heart and dream that every Filipino gets access to the best possible healthcare. With our technological prowess, we are one of the largest online pharmacies and healthcare service provider in Philippines. Learn more about us at https://getmeds.ph Qualifications: Bachelor of Science in Pharmacy Graduate Must be a licensed pharmacist No work experience required; Entry Level Must be amenable to work on-site in BF Resort Village, Las Piñas City Can start ASAP Skills Good communication skills in Filipino and English Computer Literate (Microsoft Office) Job Description: Serve as staff pharmacist responsible in the day-to-day operational task in both the physical and online pharmacy such as dispensing, counseling, maintaining updated records of government-mandated pharmacy requirements, provision of accurate pharmaceutical information or advise to the team and customers as needed Verification of online orders and inquiries as per company policy as needed Assistance in handling inventory and supply chain Contribution to the development of GetMEDS by coordination with relevant departments in accomplishing deliverables as needed Work Schedule: Six (6) days per week with fixed Saturday off We are open for applicants from Farther Luzon, Visayas and Mindanao area who are willing to relocate asap. Accommodation and travel expense to Manila will be provided*","16,000","18,000",Not Specified,Not Specified,Medicine
Joblum,PHARMACIST,Pharmacy,One Oasis Premier Holdings Corp,2021-05-14,Cavite,Not Specified,"18,000-22,000",Not Specified / In Description,Not Specified / In Description,"Job Description Candidate must possess at least a Bachelor's/College Degree, Professional License (Passed Board/Bar/Professional License Exam), Pharmacy/Pharmacology or equivalent. At least 1 year(s) of working experience in the related field is required for this position. Preferably 1-3 Yrs Experienced Employees specializing in Healthcare - Pharmacy or equivalent. Must have an excellent communication and customer-handling skills Fast learner and highly motivated Has good English communication skills Amenable to work in Molino, Bacoor Licensed Pharmacist Can start immediately","18,000","22,000",Not Specified,Not Specified,Medicine
Joblum,Licensed Pharmacist,Pharmacy,Winson Pharmacy,2021-05-14,Quezon City,Not Specified,,Not Specified / In Description,Not Specified / In Description,Qualification: Must be a Licensed Pharmacist Newly board passer will be considered Compassionate and customer service oriented Duties and Responsibilities: To ensure sufficient stocks needed for the store To assists and process customer order and provides health assessment and counseling. To monitor and report the near expiry and expired products To ensure the stock delivered from suppliers are in good condition and properly handled. To perform other tasks that may be assigned from time to time.,Not Specified,Not Specified,Not Specified,Not Specified,Medicine
Joblum,Pharmacist Clinical,Pharmacy,IKON SOLUTIONS ASIA,2021-05-14,Maldives,Full Time,,Not Specified / In Description,Not Specified / In Description,"Dispenses medications by compounding, packaging, and labeling pharmaceuticals. Controls medications by monitoring drug therapies; advising interventions. Prepares medications by reviewing and interpreting physician orders and detecting therapeutic incompatibilities. Qualifications: Candidate must possess at least a Bachelor's/College Degree , Pharmacy/Pharmacology or equivalent. At least 2 year(s) of working experience in the related field is required for this position. With experience in an at least 150-bed capacity assigned in Pediatrics & Vaccination. Applicants must be willing to work in Malé. 3 Full-Time position(s) available. Principal / Employer : Tree Top HospitalPrincipal / Employer Address : MaldivesPlacement Fee : Please be reminded that as per POEA regulations, the placement fee is up to a maximum of one (1) month's salary. For interested applicants please click “APPLY NOW” and be sure to upload your updated CV or resume through Jobstreet.",Not Specified,Not Specified,Not Specified,Not Specified,Medicine
Joblum,Pharmacist,Pharmacy,IKON SOLUTIONS ASIA,2021-05-14,Maldives,Full Time,,Not Specified / In Description,Not Specified / In Description,"Dispenses medications by compounding, packaging, and labeling pharmaceuticals. Controls medications by monitoring drug therapies; advising interventions. Prepares medications by reviewing and interpreting physician orders and detecting therapeutic incompatibilities. Qualifications: Candidate must possess at least a Bachelor's/College Degree , Pharmacy/Pharmacology or equivalent. At least 2 year(s) of working experience in the related field is required for this position. With experience in an at least 150-bed capacity assigned in Pediatrics & Vaccination. Applicants must be willing to work in Malé. 10 Full-Time position(s) available. Principal / Employer : Tree Top HospitalPrincipal / Employer Address : MaldivesPlacement Fee : Please be reminded that as per POEA regulations, the placement fee is up to a maximum of one (1) month's salary. For interested applicants please click “APPLY NOW” and be sure to upload your updated CV or resume through Jobstreet.",Not Specified,Not Specified,Not Specified,Not Specified,Medicine
Joblum,Assistant Pharmacist,Pharmacy,IKON SOLUTIONS ASIA,2021-05-14,Maldives,Full Time,,Not Specified / In Description,Not Specified / In Description,"Dispenses medications by compounding, packaging, and labeling pharmaceuticals. Controls medications by monitoring drug therapies; advising interventions. Prepares medications by reviewing and interpreting physician orders and detecting therapeutic incompatibilities. Qualifications: Candidate must possess at least a Bachelor's/College Degree , Pharmacy/Pharmacology or equivalent. At least 2 year(s) of working experience in the related field is required for this position. With experience in an at least 150-bed capacity assigned in Pediatrics & Vaccination. Applicants must be willing to work in Malé. 10 Full-Time position(s) available. Principal / Employer : Tree Top HospitalPrincipal / Employer Address : MaldivesPlacement Fee : Please be reminded that as per POEA regulations, the placement fee is up to a maximum of one (1) month's salary. For interested applicants please click “APPLY NOW” and be sure to upload your updated CV or resume through Jobstreet.",Not Specified,Not Specified,Not Specified,Not Specified,Medicine
Joblum,Accepts Without Experience | Customer Care Assistants | Healthcare Account,Pharmacy,Sykes Philippines,2021-05-14,National Capital Reg,Contract,,Not Specified / In Description,Not Specified / In Description,"Get hired today and start working from home* ASAP! *Disclaimer: Work-from-home setup is temporary. You will be required to report to our Worldwide Corporate Center site (Mandaluyong City) after the pandemic. Our recruitment team will discuss other employment details with you during your interview. WHY YOU SHOULD JOIN SYKES SYKES is the best company where you can work, learn and grow. We offer competitive salary and benefits packages, provide various learning, development and mentoring opportunities and put programs in place to promote career growth. As a multinational digital marketing and customer service global outsourcer, we partner with Global 2000 companies. That means that you get to work with the world’s biggest brands and industry leaders! Here are some of the other benefits of working in SYKES: Competitive salary, account-specific benefits and performance incentivesNight differential and night shift allowancesPaid sick and vacation leavesHMO coverage (medical and dental) for you, even during probationary period, and your qualified dependentsLife InsuranceStudy Assistance ProgramCool office spaces and employee-centric facilitiesAccessible locationsMentoring and development programs for career growth opportunitiesExclusive discounts in partner establishmentsCompany-sponsored interest clubsEmployee engagement activitiesVolunteer programsSYKES has been in the Philippines for more than 20 years and is considered the country’s first multinational contact center! *Terms and conditions apply. *The 25K* monthly package is inclusive of basic pay, incentives and allowances. The basic salary varies depending on your assessment. What are we looking for? Bachelor's degree holderNo previous work experience needed, but BPO experience is an advantageBasic knowledge of computer usage and internet navigationExcellent English communication skillsAt least 25mbps internet speed and workspace suitable for work-at-home Disclaimer: Some hiring requirements are filled immediately. To check if this job opening is still available, you may send our team a message through 09778259999 following this format – JobStreet: <Inquiry>. -- ATTESTATION By submitting your application, you acknowledge that you have read and understood SYKES Recruitment and Privacy Policy (https://www.sykes.com/philippines/sykes-recruitment-and-privacy-policy/). You attest that the personal information you provided, such as, among others, those pertaining to your academic and professional qualifications are accurate, true, complete, and not misleading. In addition, you give your consent to SYKES to verify the information you have provided relative to your application. This includes checks with your previous employers, academic and/or professional institutions and other agencies as permitted by law. You further understand that SYKES is committed to ensuring the confidentiality of your personal data through the institution of appropriate legal, organizational, physical and technical measures to protect such data consistent with applicable privacy and data security laws. You confirm and consent to SYKES (i) collecting, processing and updating your personal data in connection with your employment application and the provision of services through the Sykes e-Recruitment (e-Rec) portal; (ii) publishing your personal data via SYKES e-Rec portal (iii) transferring of your personal data to Sykes affiliates, vendors and third parties in accordance with existing laws and regulations. You are also aware that you are entitled to know whether SYKES holds your personal data, that you have the right to access your personal data, and that you may request for its supplementation, correction, or deletion, in accordance with local laws, as may be applicable. However, you acknowledge that certain personal data may be exempt from such access, correction and deletion requests pursuant to applicable data protection laws and regulations. You confirm and consent to receiving alerts and notices from SYKES regarding important events, deadlines and schedules, HR announcements and other matters of interest related to your work application and possible employment with SYKES.",Not Specified,Not Specified,Not Specified,Not Specified,Medicine
Joblum,Virtual Hiring: Customer Care Assistant (Healthcare) | No Experience Needed,Pharmacy,Sykes Philippines,2021-05-14,National Capital Reg,OJT,,Not Specified / In Description,Not Specified / In Description,"Work, learn and grow with the Top Employer and BPO Company of the Year! WHY YOU SHOULD JOIN SYKES SYKES is the best company where you can work, learn and grow. We offer competitive salary and benefits packages, provide various learning, development and mentoring opportunities and put programs in place to promote career growth. As a multinational digital marketing and customer service global outsourcer, we partner with Global 2000 companies. That means that you get to work with the world’s biggest brands and industry leaders! Here are some of the other benefits of working in SYKES: Competitive salary, account-specific benefits and performance incentivesNight differential and night shift allowancesPaid sick and vacation leavesHMO coverage (medical and dental) for you, even during probationary period, and your qualified dependentsLife InsuranceStudy Assistance ProgramCool office spaces and employee-centric facilitiesAccessible locationsMentoring and development programs for career growth opportunitiesExclusive discounts in partner establishmentsCompany-sponsored interest clubsEmployee engagement activitiesVolunteer programsSYKES has been in the Philippines for more than 20 years and is considered the country’s first multinational contact center! *Terms and conditions apply. What are we looking for? Completed at least 2 years of college educationBPO experience is requiredBasic knowledge of computer usage and internet navigationCan communicate in English Disclaimer: Some hiring requirements are filled immediately. To check if this job opening is still available, you may send our team a message through 09778259999 following this format – JobStreet: <Inquiry>. -- ATTESTATION By submitting your application, you acknowledge that you have read and understood SYKES Recruitment and Privacy Policy (https://www.sykes.com/philippines/sykes-recruitment-and-privacy-policy/). You attest that the personal information you provided, such as, among others, those pertaining to your academic and professional qualifications are accurate, true, complete, and not misleading. In addition, you give your consent to SYKES to verify the information you have provided relative to your application. This includes checks with your previous employers, academic and/or professional institutions and other agencies as permitted by law. You further understand that SYKES is committed to ensuring the confidentiality of your personal data through the institution of appropriate legal, organizational, physical and technical measures to protect such data consistent with applicable privacy and data security laws. You confirm and consent to SYKES (i) collecting, processing and updating your personal data in connection with your employment application and the provision of services through the Sykes e-Recruitment (e-Rec) portal; (ii) publishing your personal data via SYKES e-Rec portal (iii) transferring of your personal data to Sykes affiliates, vendors and third parties in accordance with existing laws and regulations. You are also aware that you are entitled to know whether SYKES holds your personal data, that you have the right to access your personal data, and that you may request for its supplementation, correction, or deletion, in accordance with local laws, as may be applicable. However, you acknowledge that certain personal data may be exempt from such access, correction and deletion requests pursuant to applicable data protection laws and regulations. You confirm and consent to receiving alerts and notices from SYKES regarding important events, deadlines and schedules, HR announcements and other matters of interest related to your work application and possible employment with SYKES.",Not Specified,Not Specified,Not Specified,Not Specified,Medicine
Joblum,PHARMACIST for CATBALOGAN AND CATARMAN SAMAR,Pharmacy,"Watsons Personal Care Stores (Philippines), Inc.",2021-05-14,"Leyte (Tacloban City), Northern Samar, Western Samar",Full Time,,Not Specified / In Description,Not Specified / In Description,"JOB SUMMARY: The Pharmacist is responsible for dispensing, giving medicine information and monitoring drug therapies. He/ She works to legal and ethical guidelines to ensure correct and safe supply of medicines to the general public.The position is also responsible for the delivery of all regulatory compliance and commercial result of the Drugstore through management of day-to-day operations and implementation of Good Pharmacy Practice (Store Environment, Dispensing Process, Health and Wellness Advocacy and Regulatory Requirements). JOB REQUIREMENTS: • Candidate must possess at least a Bachelor's/College Degree, Professional License (Passed Board/Bar/Professional License Exam), Pharmacy/Pharmacology or equivalent.• Required skill(s): leadership skill, RETAIL PHARMACY OPERATION.• No work experience required.• 2 Full-Time position available.",Not Specified,Not Specified,Not Specified,Not Specified,Medicine
Joblum,Assistant Pharmacist (Kamuning Quezon City),Pharmacy,SEIRYU JAPANESE PHARMACY,2021-05-14,Quezon City,Not Specified,"17,000-23,800",Not Specified / In Description,Not Specified / In Description,"RESPONSIBILITIES CUSTOMER EXPERIENCE Attends patient queries regarding available medications in the store Counter checks prescriptions and medicines to be issued by pharmacy assistants COMPLIANCEProvide assistance with the Pharmacy Manager in obtaining permits and license of selling drugs INVENTORY MANAGEMENTOver-all in-charge of inventory management through monitoring of stocks, expiration date and purchasing JOB QUALIFICATIONS Candidate must possess at least Bachelor’s Degree in Pharmacy/Pharmacology or equivalent MUST BE A REGISTERED PHARMACIST Proactive and with good interpersonal and communication skills Knowledgeable in FDA/BFAD/DOH procedure and documentation is a PLUS New board passers are welcome to apply Willing to work in a start-up company At least 2 Year(s) of working experience in the related field is required for this position. Required Skill(s): Communication, Negotiation, Customer Service Preferably Supervisor/5 Yrs & Up Experienced Employee specialized in Healthcare - Pharmacy or equivalent.","17,000","23,800",Not Specified,Not Specified,Medicine
Joblum,Pharmacist for Makati Ave,Pharmacy,Pharma Group,2021-05-14,National Capital Reg,Not Specified,,Not Specified / In Description,Not Specified / In Description,"Duties and Responsibilities: Reports to the Operations Supervisor in his/her absence the Area Supervisor. Ensures the sufficiency of fast moving medicines in the store. Forecast supplies needed for the store. Monitors the condition of medicines and other stocks by checking its expiration dates and delivery dates. Monitors and checks the inventory of store items and cash. Trains pharmacy assistant with existing and new company and legal guidelines and procedures. Assist customers by providing pertinent information about the products and services, providing advice about health issues, symptoms and medications in response to customer inquiries. Ensures the compliance of the store with statutory procedures(e.g. prescription required for Rx drugs) Supervise performance of pharmacy assistants. Creates shift schedule in accordance with store operations. Performs other task as may be assigned from time to time. Qualifications: Licensed Pharmacist Keen on details Proficient in Excel and other computer functions With at least 1 year of work experience as retail/store pharmacist Average written and oral communications skills Compassionate and customer service oriented Dedicated, responsible,and hardworking Newly board passer will be considered Willing to be assigned in Makati Ave.",Not Specified,Not Specified,Not Specified,Not Specified,Medicine
